{
  "$schema": "urn:openaix:schema:measure-aor:0.1.0-draft.2",
  "active": {
    "continuous": true
  },
  "description": "Area of responsibility of the CJTF-OIR air component in this order, from eastern Jordan to the Euphrates valley; the airspace control area follows it.",
  "geometry": {
    "kind": "polygon",
    "rings": [
      [
        {
          "latitude": 32.54,
          "longitude": 36.9
        },
        {
          "latitude": 32.54,
          "longitude": 40.9
        },
        {
          "latitude": 35.8,
          "longitude": 40.9
        },
        {
          "latitude": 35.8,
          "longitude": 36.9
        },
        {
          "latitude": 32.54,
          "longitude": 36.9
        }
      ]
    ]
  },
  "id": "oir-aor",
  "name": "OIR area of responsibility",
  "type": "AOR"
}
